tnum,tweet,existence
1380,Take Action @change: Help Protect Wildlife Habitat from Climate Change http://bit.ly/9Ogdyi #climatechange #SierraClub #SaveTerra 30,Y
2239,"DK Matai: Are Global Warming, Volcanoes and Earthquakes Linked?: A thaw of ice caps in coming decades caused by g... http://huff.to/avcX6b",Y
2533,Organic agriculture: a guide to climate change and food security http://www.environmentportal.in/node/302789,Y
4238,Just had a near perfect shooting of an upcoming Greenpeace video about the global warming denyers.  Great work everyone!,Y
554,Volcanic ash cloud: Global warming may trigger more volcanoes [link],Y
2172,E.P.A. Makes Its Case on Climate Change: The E.P.A. releases a glossy report to help Americans make sense of clima... http://bit.ly/beCmid,Y
4501,Is the Giant Squid Invasion due to Global Warming? - http://fwix.com/article/3_19cd7519b2,Y
1619,Climate change deadly? Scientists suspect global warming may be contributing to strange deaths of Arctic birds. http://tinyurl.com/yaqbeop,Y
3058,"The Global Climate: Yes, Its Still Warming stop global warming :) http://bit.ly/b2du4M",Y
344,reading from @time Allergies Worse Than Ever? Blame Global Warming [link],Y
367,Reinvent Cities to Stop Climate Change [link],Y
1629,"Clean Technology Industry Forecast is Strong Due to Global Warming Concerns ...: April 12, 2010 (MMD Newswire) -- ... http://bit.ly/bUSB2O",Y
5903,Theologian: 'Climate Change Is the Totalitarian's Dream Come True' @CNSNews_com http://ow.ly/1CiFw,N
4707,RT @disturbedwater: DC snowstorm: how global warming makes blizzards worse (via @TIME) http://bit.ly/aMGM77,Y
3739,The GOP really cannot grasp that snow in one state doesn't refute global climate change. Idiots: http://ow.ly/14oBf,Y
1579,"Why cleaner air could speed global warming: Aerosol pollution, which is now on the downswing, has helped keep the ... http://lat.ms/adYnMi",Y
1918,"@madlyv really, wtf?!  global warming?  : )",N
4590,GayandRight: Global warming kills livestock in Mongolia....: Aid groups have described piles of dead animals and w... http://bit.ly/ddMOY0,Y
4070,@GovernAmerica You're bluffing. There is overwhelming consensus among climate scientists for the basic global warming narrative.,Y
424,Just signed an #earthday petition to take action on climate change via @rockthevote: [link],Y
3880,RT @huffingtonpostz Canada's Wolverine Population Declines As Result Of Climate Change http://is.gd/7GSpU &lt;- and lack of more X-Men sequels,Y
3669,India abandons UN's Intergovernmental Panel on Climate Change (IPCC) as untrustworthy http://bit.ly/abMsJt,N
3386,Our 'watchdog press' enabled the global warming hoax: http://bit.ly/b6LKba,N
261,RT @rubberstamprosk: RT @MotherJones: Yet another gift from global warming: increased allergy attacks [link],Y
1130,South Asian nations to fight climate change: Foreign ministers of eight South Asian nations met in this secluded H... http://bit.ly/cE3hoX,Y
1915,Los Angeles: A religious spin on climate change http://losangeles.cityandpress.com/news/2010/05/01/religious-spin-climate-change,Y
508,"The Key to Fixing Global Warming China | Magazine: It's late November 2009, and US energy secretary Steven Chu is ... [link]",Y
670,"Your Voice: The fraud of global warming: by Tim Michael Case, Tracy Since the early 1970s, our public school syste... [link]",N
3408,Snowmageddon' in DC and we still can't see global warming/weirding at work. Theologians call it 'willful blindness.' http://bit.ly/aK8oAG,Y
5019,Atmospheric carbon dioxide that is causing climate change is also negatively affecting the marine environment http://bit.ly/drW0Nu ^AB,Y
426,"Global warming: Believe it - Vallejo Times-Herald: Your editorial on global warming (""Keeping the debate honest,"" ... [link]",Y
3790,"@whpatterson because of climate change, of course. KIDDINGGGGGGGG",N
618,Global warming threatens Armenia by 2C higher temperature [link],Y
5210,"RT @blogdiva: RT @NavyNews: Global warming on Navy radar. ""New"" normal for the Arctic is to be not completely frozen. New normal? http://bit.ly/9uFZaj",Y
4937,Arctic climate changing fast: Climate change is transforming the Arctic environment faster than expected and accel... http://bit.ly/ckRjPW,Y
1892,RT @GClugo: RT @guardianscience Climate scientist sues newspaper for 'poisoning' global warming debate http://bit.ly/bk55t0 #p2 #tcot,Y
2281,New blog post about competing or complementary corporate financial disclosure rules for #climate change liability http://bit.ly/bRJNrY,Y
5870,RT @G_Lauricella: Is Climate Change Genocide? http://bit.ly/asmJGu,Y
3259,New on http://ekwire.com -- Hannity: Snow Storms 'Contradict Gore's Global Warming Theories' -- http://ow.ly/15SFQ,N
1546,"RT @WGofNYC Leader of National Indigenous Women's Org, ""Climate Change is Not Just abt the Climate, its abt R Lives"" bit.ly/9GdzRw",Y
5195,Predicting future climate change through sediments http://bit.ly/b27X1s #science #research,Y
160,"Global warming is a threat, after all|Tim Blair rounds up the latest news from the wild frontiers of global .. [link]",Y
3539,@DavidCornDC Another DC snowstorm? Where's the global warming?,N
1265,"RT @EcoSteward: This #EcoMonday, @InvasiveNotes discussion of climate change and invasive species recommended: http://bit.ly/a0re9B",Y
1569,Reinvent Cities to Stop Climate Change | Green Living Ideas  http://bit.ly/cpFCze #cities #climate #eco,Y
2303,"@climatecentral's Ben Strauss: ""We are inviting the planet to humble us"" via climate change, other enviro ills. http://huff.to/dbitCD",Y
1463,Filmmaker Travels The Globe To Find People Fighting Climate Change ... http://bit.ly/bgM3w5,Y
3642,The power is out. This is fun. At least I have beer. Global warming=fail.,N
33,the scientific community was scamed by global green  gov warming scam.,N
4285,"@Lisa_Michele Yeah, it's not like Global Warming is real or anything. How does one justify something FAKE?",N
381,Demand Congress take action on climate change. Pls sign the petition. [link],Y
1131,"Climate change increases heat waves, floods|WASHINGTON (Reuters) - Deaths from heat waves, property damage from .. http://oohja.com/xbNDn",Y
1637,"Climate change affects subterranean ecosystems|Changes above the ground, such as a higher concentration of carbon .. http://oohja.com/xc5Mz",Y
4552,Check this out - the cost of climate change: http://www.nrdcactionfund.org/thisisourmoment/?p=1281&c=349598&s=762984&l=81599,Y
2565,RT @gb_Joe: The tolerant left: deny climate change and you'd be guilty of a crime against peace http://bit.ly/aFfkez,Y
400,Take Action @change: Help Protect Wildlife Habitat from Climate Change [link],Y
8,Southern Africa: Competing for Limpopo Water: Climate change will bring higher temperatures to Southe... [link],Y
4242,"Global Warming Dent's El Ni'o's Protective Shield From Atlantic Hurricanes, Increase Droughts http://cli.gs/LEnPp",Y
169,"Bats, Birds and Lizards Can Fight Climate Change By Eating Insects: Birds, bats and lizards may play an important... [link]",Y
4512,Climate Change Watch India: Air Pollution Control http://bit.ly/dB2A9L,Y
469,#California taking the lead on #climate change: [link],Y
2114,At the #PEN talk on climate at Met. @Revkin offers a useful note of realism. Climate change is in our heads-and we need to change our heads,N
1580,Why cleaner air could speed global warming http://lat.ms/cCps7Q,Y
136,Arctic Beauty in Black and White: Alaska Before the Effects of Global Warming [Slide Show]:  Toward the end of Wor... [link],Y
3516,"@syancyfox5  now its 14""-20 FML i sorry but I htink im going team Plain global warming does not exist",N
1377,"If capitalism doesnÀ_t end climate change, climate change will end capitalism - #degrowth http://bit.ly/afdSTy",Y
1382,Take Action @change: Help Protect Wildlife Habitat from Climate Change http://bit.ly/9Ogdyi #climatechange #SierraClub #SaveTerra 31,Y
3065,Climate change has high costs and very distributed benefits,Y
2550,"what a hot &humid summer we r running through.please minimise the effects of global warming,get us rid from abnormal weather change.",Y
1979,Global Warming of the Heart: Earth Day is over. Or is it? Thousands -- perhaps millions -- of conscious actions t... http://huff.to/a3OCsr,Y
1372,"China active, serious in tackling climate change, says vice president | Humani.. http://retwt.me/1MN3W (via @NewsOnGreen)",Y
4576,Jerry Brown's global warming revenge?: Backers of a proposed ballot initiative to suspend California's landmark gl... http://bit.ly/a5QLF0,Y
5082,should tie a liberal global warming scum to front of every snowplow in dc. and drag morons who voted for them behind it.,N
4441,"@LaurenConrad Oh.  Well, there goes the global warming theory LOL",N
3499,"RFK, Jr. 15 months ago: Global warming means no snow or cold in DC http://goo.gl/fb/Y4pz",Y
1610,Global Warming Likely to Worsen Allergies in Maine: That's according to a new report released today by the Nationa... http://bit.ly/9rpS9P,Y
1612,Global warming or unemployment...choose your own disaster?: By Max Jacobs Companies producing greenhouse gases in ... http://bit.ly/cuF4Kq,Y
4920,Disclosing the real risks of climate change http://ff.im/-fBj8k,Y
5268,"Plan now for climate change, says researcher &gt; FOODweek Online &gt; Main Features Page http://retwt.me/1N0l7 (via @FOODweek)",Y
4690,"Look, It's Snowing! So Much for ""Global Warming,"" Eh, Jim DeMint?: If you live anywhere between DC and Bo... http://bit.ly/95JuCE #politics",N
3594,"RT @joshtpm global warming prolly real in New York, but big scam in DC",N
457,Fight Climate Change From All Fronts: [link],Y
444,"Rejoice, NY Times mentions crop wild relatives in article about adapting agriculture to climate change [link]",Y
4604,"MADE UP NUMBERS, FALSE DATA, EAST COAST BURIED IN SNOW, REASON TO KEEP PUSHING GLOBAL WARMING IS ONLY TO HAVE CONTROL OF OUR MONEY",N
1409,Climate change and Why Your Allergies Are Getting Worse http://bit.ly/dzYKHK /via @MotherJones,Y
3098,"Hill devotes article to baseless global warming attacks, Gore bashing http://dlvr.it/1gGj",Y
259,Climate Change: Geologists Drill Into Antarctica & Find Troubling Signs 4 Ice Sheets' Future À_  Melt Could Come FAST [link],Y
144,"Higher temperature, sea level due to global warming|KUALA LUMPUR: Malaysia's average temperature has risen by 1.1 .. [link]",Y
1935,Environmental Groups Praise BASIC Meeting on Climate Change: Environmental groups are giving qualified praise to a... http://bit.ly/aO6Kn0,Y
640,Gulf Coast spill better give Climate Change Legislation some momentum. It's a bigger tragedy than we're even aware of yet. #P2,Y
4122,";O From Maple Syrup to Snow Pack, Global Warming Happening Here and  stop global warming http://bit.ly/cidu7j",Y
1229,Ocean Saltiness Shows Global Warming Is Intensifying Our Water Cycle http://bit.ly/bJsszY,Y
453,Fight Climate Change From All Fronts: [link],Y
4938,"George Perkins: Clean Energy Jobs Act vital to reduce global warming, create jobs, cut pollution|Dear Editor: I .. http://oohja.com/x6CG5",Y
1199,RT @Oxfam #Climate change makes farmers & pastoralists in #Ethiopia increasingly vulnerable http://bit.ly/alhpwN #earthday,Y
1596,Global warming may make cricket bats history: London: Cricket is facing a bizarre threat following a European Unio... http://bit.ly/bemHL3,Y
494,EXCLUSIVE - Climate change could raise cost of U.S. allergies [link],Y
1174,RT @Newsweek: Global Warming Kills Forests In Colorado http://bit.ly/coOWIt,Y
5197,Predicting future climate change through sediments http://bit.ly/b27X1s #energy #green,Y
1591,Coalition of the Tired of Waiting: Fighting Climate Change at Ground Level http://bit.ly/8ZcErl,Y
2773,Reuters AlertNet - Accelerated migration and climate change a 'recipe for social disaster'-UN http://retwt.me/1LY7U (via @alertnetclimate),Y
5084,Economics Must Align with Climate Change http://bit.ly/boCsqs #energy,Y
529,Spring Comes 10 Days Earlier In U.S. Due To Climate Change: [link],Y
582,Why cleaner air could speed global warming [link],Y
1468,Arctic Ice Loss Accelerating Global Warming: Research: TopNews New Zealand Global warming may be getting worse tha... http://bit.ly/cx7Jz2,Y
1775,RT @TribecaFilmFest: RT @jpatricof: @jessicaalba and sebastian copeland at premiere of climate of change right now #tribeca,Y
5339,CLIMATE CHANGE REGULATION IS A STUPID THOUGHT & WASTE OF TIME! BEEN DISPROVED BY ONES WHO INITIATED HYPOTHOSYS! IDIOTS!,N
2746,"Global warming is POUNDING the East coast with snow. Don't ask me how it works, I'm just reporting. #tcot, #right, #rightblogs, #teaparty",Y
2343,From @wired: The Key to Fixing Global Warming? China http://ow.ly/178p5k,Y
2379,Hurrah - #NDP Climate Change Bill passes report stage vote: one step closer to real targets to stop climate change! #cdnpoli,Y
6013,Cal) probably represent the views of global warming skeptics. http://bit.ly/9Swo7u,N
115,"CLIMATE CHANGE: Forests Not for Absorbing Carbon, Say Activists [link]",Y
172,scary RT @ClimateProject Climate change altering U.S. seasons: Spring 10 days early: [link],Y
5073,@oxchris the snow should be blamed on global warming.. I mean global cooling.. I mean.. Oh you know.. It's all bull anyway!,N
5192,I do love seeing ice chunks in the East River. It's like our little Earth is just fighting global warming tooth and nail.,Y
1098,US Generals say: Climate Change Threatens America's Security: The Pentagon has made it well known that it consider... http://bit.ly/aZ754n,Y
251,"UW biologist links early blooms to global warming|Associated Press - April 21, 2010 6:15 AM ET STEVENS POINT, .. [link]",Y
3418,"#fb Goddammit, folks, blizzards don't negate climate change. The science isn't debating this. Climate change is real. End of story.",Y
184,Official NASA Report: Sun Causes Climate Change:  [link],Y
29,"Eaarth: global warming is here to stay, how will we deal with it? [link]",Y
2636,Enviro:  European Space Agency launches satellite to check climate change.. see blast-off!=&gt;  http://ow.ly/1xaGk,Y
2540,I hate global warming! #StopGlobalWarming #StopGlobalWarming,Y
1121,Wed @sciam podcast: Mountain Vs. Valley Temps Stretch Apart With Climate Change http://bit.ly/aVW0AT,Y
3287,RT @MilesGrant: RT @EricBoehlert Why won't Drudge acknowledge snow-less 'Global Warming Games' in Vancouver? http://ow.ly/15S0O #climate,Y
5905,Just posted The Supply Side Effects of Climate Change on Tourism http://bit.ly/b5cajw #b2p,Y
21,"Topography of Mountains Could Complicate Rates of Global Warming: ScienceDaily (Apr. 25, 2010) À_ A new study concl... [link]",Y
1301,RT @beckbasher: RT @IanDavidB: RT @Shoq: CLIMATE CHANGE DENIERS: Bobby Jindal mocked volcano warnings. Read the papers lately? Start thinking for yourselves,Y
3837,"RT@rff_org New video: Experts talk climate change, extreme weather, and insuring the next Katrina. http://bit.ly/7Hz0WQ",Y
5225,;P http://bit.ly/dAuSjA global warming solutions Innovation has climate change in hand,Y
4716,RT @EricBoehlert: Why won't Drudge acknowledge the snow-less 'Global Warming Games' about to kick off in Vancouver? http://tinyurl.com/yzq4olr,Y
1425,Treating Climate Change as a Curable Disease http://viigo.im/3fSu,Y
2569,"Must See Places Before They Disappear! : Europe...[PICS]: If Global Warming Predictions prove to be true, the foll... http://bit.ly/cLThD2",Y
2929,The massive rainstorms and lots of terrible weather is affecting our planet something must be done about global warming soon,Y
5892,Ice-covered volcanoes may answer climate change questions: Eruptions from mountains such as Iceland's Eyjafjallajo... http://lat.ms/dy3IFL,Y
4798,"Global Warming Monitoring Needs to Find 'Missing Heat', say Scientists|by David Adam Experts need to beef up ways .. http://oohja.com/xaXYM",Y
281,[#Meat-Wise]  Cynthia Bateman on Meat-Wise Monday: How Animal Agriculture Makes Global Warming Worse [link],Y
1254,Global warming evidence all around us|A message to global warming deniers and doubters: Just look around our .. http://oohja.com/xbhVZ,Y
1534,Baby boomers must tackle global warming while they can: By Anonymous Baby boomers have enjoyed peace and the large... http://bit.ly/bw322k,Y
6006,"sometimes so hard to predict which of the outcomes in climate change ( #green revolution vs. #apocalypsenow) would be more ""exciting"" to me.",Y
5850,"Soaring mercury; Blame it on global warming|Agartala, Apr 14 : Environmentalists have attributed the .. http://oohja.com/xaN2I",Y
1151,RT @jerryjamesstone: Alaska Before the Effects of Global Warming [pics]: http://digg.com/d31PUXt?t,Y
5483,Missing' heat may affect future climate change | Humanitarian News http://retwt.me/1MSsH (via @NewsOnGreen),Y
1364,"Green:Net: How the Internet, Computing Can Fight Climate Change: The Internet, software, computing... http://bit.ly/9exozj (Via @inhabitat)",Y
1665,@OTOOLEFAN REAL science. Not Algore's climate change 'science' hacks with their man-made global warming hoax. Gore=Palin,N
4141,"RT @SeegerCycle Senate global warming meeting on hold from record snow fall #tcot // Yes, this disproves global warming(if ur illiterate)",N
5113,I think we can all agree this Prius disaster proves once and for all that global warming doesn't exist /via @StephenAtHome,N
3994,Hey Al Gore- Could you sprinkle some Global Warming fairy dust on my car tonight? We're supposed to get 10-14 inches of snow by the morning.,N
4264,how one should really and sincerely try to stop the deadly effects of global warming. instant solutions ? http://bit.ly/bKV0Kp :P earth,Y
3256,How Global Warming Makes Blizzards Worse http://goo.gl/5UL1,Y
3632,"What's Hot: Seattle Takes on the Junk Mail Industry: When it comes to curbing climate change, some things are easi... http://bit.ly/buTsNb",Y
1208,GECKO 10 first steps to greener living: It all seems so daunting: Climate change. Carbon credits. Not to mention ... http://5vj09.tk GECKO,Y
1401,Take Action @change: Help Protect Wildlife Habitat from Climate Change http://bit.ly/9Ogdyi #climatechange #SierraClub #SaveTerra,Y
1105,EPA Confirms Climate IS Changing: In another display of the sea change that has occurred at the US Environmental P... http://bit.ly/bb2l7d,Y
2227,"Celebrate Earth Day 2010 by watching ""The Climate Change Rally"" in DC online today (Sunday, April 25). http://tinyurl.com/2da96cc",Y
2469,Carbon in warming soil could accelerate climate change: Study http://bit.ly/aVP2gd,Y
449,UK leads the way! RT @10cities Schumacher College: Mobilising Democracy to Tackle Climate Change [link],Y
4335,"Forests Are Growing Faster,Climate Change Appears to Be Driving Accelerated Growth (Science Daily) http://bit.ly/d1EqlN @InvasiveNotes",Y
2876,India needs more research on climate change: Shyam Saran | CalcuttaTube http://retwt.me/1LVKY (via @calcuttatube),Y
2830,"Government run climate-change: http://bit.ly/cX1XGw There is no global warming, the sky is not falling! Get a grip you tree hugging wackos!",N
2828,The issue of global warming must be dealt with it's time for alternative energy sources which won't harm out planet.,Y
588,SCIENCE: Scientists explore the evolution of climate change [link],Y
1495,New facts support global warming case: Recent letter-writer Charles Kesner is either out-of-touch with reliable ne... http://bit.ly/9AB5Sb,Y
4126,New Ozone Standards could contribute to warming ;O global warming for kids http://bit.ly/b3dgCw,Y
1557,"Safe, secure nuclear energy must be part of climate change solution http://bit.ly/a8xqgM",Y
1549,Buying carbon offsets may ease eco-guilt but not global warming http://bit.ly/conBCO,Y
2615,RT @EcoInteractive: #RTR Reversing forest decline can combat climate change http://bit.ly/RFdecline,Y
35,40 degrees in NYC. please urinate on next liberal global warming /climate change scum you see.,N
1658,"Rationalists' who believe aliens exist & global warming=caused by humans, might as well believe in Jesus miracles,angels &fairies #tcot #p2",N
4449,"I guess we need to stop saying ""global warming"" & replace it w/ ""climate crisis"" for Repub's sake. gw just short circuits their brain.",Y
354,Exclusive: Climate change could raise cost of U.S. allergies| Reuters [link],Y
398,Take Action @change: Help Protect Wildlife Habitat from Climate Change [link],Y
86,"Don Blankenship: Mine Safety Regulators ""As Silly as Global Warming"" [link]",N
489,EPA Climate Change Indicators Report Shows the Evidence of Global Warming All ...: Natural Resources Defense Counc... [link],Y
5184,"Solar Radiation Management: Dr. Strangelove?s Fix for Global Warming|Ever hear of Solar Radiation Management? No, .. http://oohja.com/x6mVY",Y
5973,"BRKG NEWS: UN Climate Change panel gets F from scientists, announces it will rehabilitate itself by suing Iceland over volcanic eruption.",N
1200,"Denis Hayes, founder of Earth Day, compares global climate change to Irish Famine (IrishCentral) News Weather Politics http://bit.ly/9XCuA1",Y
4609,"FUN GAME: Next time someone says ""So much for global warming,"" push them into a snowdrift and run away.",Y
1126,Arctic rain in April 'is sign of global warming'|The Canadian Arctic has been hit by rain in a sign that the .. http://oohja.com/xbPyL,Y
1544,URUGUAY: Tools Needed for Those Most Vulnerable to Climate Change: Global Geopolitics Net Sites / IPS In__s Acosta... http://bit.ly/alYhq4,Y
3302,"@1kevgriff it's nature's way os saying ""Global warming my a$$!""",N
254,Global warming evidence all around us|A message to global warming deniers and doubters: Just look around our .. [link],Y
3577,"Where Is Global Warming? by Rebecca Terrell, NewAmerican.com http://bit.ly/9RPSIZ",N
552,Birds in southern England suffer from global warming [link],Y
183,Now on PBS: Going Green New York: Examining how New Yorkers are confronting climate change Check local listings [link],Y
6077,"Bats, Birds and Lizards Can Fight Climate Change - Birds, bats and lizards may play an important role in Earth's cl... http://ow.ly/172hQh",Y
5021,@GurianPeck the GOP always finds a way to push its agenda. two crippling snowstorms in one month are in line with global CLIMATE CHANGE.,Y
3456,And Mother Nature reinforces the fact that global warming is but a left-wing conspiracy by bringing yet MORE SNOW. http://bit.ly/cn8jen,N
625,Latest weapon in global warming fight À_ 'green' cement made from rice: By FIONA MACLEOD AND RUAIRI CREANEY SCIENTI... [link],Y
3695,RT @newtgingrich: Historic snow storm in washington-third this year-where is al gore to explain it snows this heavily as a sign global warming is imminent,N
2193,Science!: Whales Fight Global Warming http://tinyurl.com/2vwys8q,Y
4252,"Obama Creates NOAA Climate Service""to help governments & businesses adapt to climate change""It is as if Obama lives on another planet #tcot",N
4802,"Study assesses effects of earlier springs http://tr.im/NuV9 KB: More than 25,000 reasons to stop global warming. #eco #green",Y
2745,Climate change set to reduce crop production in Africa - environmentalresearchweb http://retwt.me/1LYtc (via @kaskadia),Y
1608,Allergies Worse Than Ever? Blame Global Warming http://bit.ly/aJKsz3,Y
4775,Just posted European Forests and Carbon Sequestration Services: An Economic Assessment of Climate Change Impacts http://bit.ly/awFKHw #b2p,Y
2817,Mayor calls for Londoners' ideas to help tackle climate change http://retwt.me/1LWVs (via @MayorOfLondon),Y
1509,"Global Warming: Ocean chemistry is changing faster than it has in 800,000 years: And that's because of the carbon ... http://bit.ly/cdflgK",Y
5502,Weekly Mulch: Cochabamba Summit to Combat Climate Change Innovatively | Blog N.. http://retwt.me/1MS5u (via @BlogNewsWeb),Y
1159,RT @Newsweek: Global Warming Kills Forests In Colorado http://bit.ly/coOWIt,Y
507,Renewable Energy Advances À_ Ocean Saltiness Shows Global Warming ...: After pulling data from 1.6 million salinity... [link],Y
4082,. global warming Study Says Arctic Ice Melt to Cost Global Economy $2.4 Trillion http://bit.ly/dxIaFb,Y
2928,The global warming is totally messing up the weather patterns in this world and is causing violent weather storms worldwide very hurtful,Y
5159,This is not good news :( CO2 May Cause Even More Global Warming Than Originally Thought http://bit.ly/7NdFRn #eco #green #globalwarming,Y
2991,Global Warming Wont Melt Ignorance stake  :),Y
3173,"@theaarondouglas Don't forget that a few years ago, people were claiming a lack of snow in DC was due to Global Warming. Fix your message.",N
25,effects of global warming À_ YouTube À_ Effects of Global Warming Stats: Back with more news for you today. It's ama... [link],Y
1581,Why cleaner air could speed global warming http://lat.ms/cCps7Q,Y
3537,"RT @davidcorndc: Can someone please explain to conservatives that with climate change, some areas will get colder and weather patterns will shift.",Y
3879,Global Warming Update http://ow.ly/16uUpb,Y
1484,EPA issues report on U.S. climate change indicators - warming is having measurable effect across ecosystems http://bit.ly/c9RnR6,Y
668,@foxandfriends global warming is like the goldman execs... full of sh*t,N
1523,"#CUBeyond: Wlliam Lau says climate change is happening and we must deal with it, no matter what is causing it.  #ChapmanU",Y
5199,How Climate-Change Fanatics Corrupted Science -- Michael Barone -- GOPUSA - http://shar.es/aNasC,N
1614,@Climate change Giant #Glacier Fall in Peru Causes Deadly Tsunami : http://bit.ly/bvG95C,Y
193,"Watch video: Climate change threatens sacred Tibetan mountain, including land known as Shangri-La [link]",Y
2958,Climate Change Impacts And Vulnerability In The Eastern Himalayas - Indigenous Peoples Issues ... http://ow.ly/1odXhP (via @RaysFreedomHash),Y
3658,"More on why bogus ""global warming consensus"" is fading fast: Margaret Wente of Toronto's Globe and Mail explains w... http://bit.ly/bClZes",N
3133,Man! I wish there was such a thing as global warming! #snowpocalypse #snowmaggedon,N
443,"85 degrees in April eh? Hellooo global warming, nice to meet u",Y
4770,Grrrr...Global Warming My BUTT! 2nd MAJOR snowstorm within days!,N
